{"aggregateHash":"0000000000000000000000000000000000000000000000000000000000000000","structuralAnchors":[],"textAnchors":[{"anchorOrdinal":0,"canonicalEndByte":1,"canonicalStartByte":0,"sourceFragments":[{"fragmentOrdinal":0,"views":[{"decodedScalarEnd":1,"decodedScalarStart":0,"endColumn":1,"endLine":0,"kind":"source_text_position","opaqueSourceUnitId":"0000000000000000000000000000000000000000000000000000000000000000","rawByteEnd":1,"rawByteStart":0,"startColumn":0,"startLine":0}]}]}],"version":2}